{"accepted_observation_count":100000,"attempt_count":100500,"campaign_manifest_id":"rcid:v1:campaign-manifest:h:jcs-sha256-v1:3a2df1d804fa11b7c6e30af6995bb88a5574ca8c89d5a32a9436a4590fbcc9a8","evidence_manifest_id":"rcid:v1:evidence-manifest:h:jcs-sha256-v1:1572476aa1b968530356d3a310ab78eb267a3d775e3f10d760ab76e600b7cb34","evidence_manifest_reference":{"category":"scale-manifests","relative_path":"scale-manifests/sha256/a2d8d1c460d7822bc2212df41d41842e02202961caad7bc17ca1b68204ae07fa.json","sha256":"a2d8d1c460d7822bc2212df41d41842e02202961caad7bc17ca1b68204ae07fa","size_bytes":244518},"infrastructure_failure_attempt_count":500,"interruption_count":3,"logical_execution_count":100000,"reconciliation":"exact","result_shard_count":402,"schema_version":"scale-execution-report.v1","session_summary":{"active":0,"completed":1,"failed":0,"forced_interruption":3,"total":4},"trust_class":"trusted_executioner"}
